{
  "_type": "https://in-toto.io/Statement/v1",
  "subject": [
    {
      "name": "metrics.json",
      "digest": {
        "sha256": "e24947c835234fff34c5f94d0594884d48aeb5f49d03358c2d6c3f671bd3da1a"
      }
    },
    {
      "name": "results.ndjson",
      "digest": {
        "sha256": "e3b0c44298fc1c149afbf4c8996fb92427ae41e4649b934ca495991b7852b855"
      }
    },
    {
      "name": "run.json",
      "digest": {
        "sha256": "9490d9b06d37ec2192575b0ee6977a58f100e322b2312e00af7b4bb69da45a2c"
      }
    },
    {
      "name": "summary.json",
      "digest": {
        "sha256": "9564b987de3f4e877683eb9a428348ee1ebb3fbd501af7339f74d4b057dc0d73"
      }
    },
    {
      "name": "metrics.json",
      "digest": {
        "sha256": "e24947c835234fff34c5f94d0594884d48aeb5f49d03358c2d6c3f671bd3da1a"
      }
    }
  ],
  "predicateType": "https://agenteval.dev/evidence/v2",
  "predicate": {
    "schemaVersion": "2.0",
    "runId": "01928f3f-0000-7000-8000-000000000001",
    "runHash": "cceb139db7d179975afbcf1c5ea7a2732500f1258f33f55f93de167d3d9442be",
    "producer": {
      "name": "agenteval-cli",
      "version": "0.44.0"
    },
    "subject": {
      "ref": "agent:people/hr-bot"
    },
    "deployment": null,
    "suite": null,
    "judges": [],
    "closedAt": "2026-10-03T09:00:05Z",
    "sealedBy": "ingest"
  }
}
